approved_at_utc,subreddit,selftext,author_fullname,saved,mod_reason_title,gilded,clicked,title,link_flair_richtext,subreddit_name_prefixed,hidden,pwls,link_flair_css_class,downs,thumbnail_height,top_awarded_type,hide_score,name,quarantine,link_flair_text_color,upvote_ratio,author_flair_background_color,subreddit_type,ups,total_awards_received,media_embed,thumbnail_width,author_flair_template_id,is_original_content,user_reports,secure_media,is_reddit_media_domain,is_meta,category,secure_media_embed,link_flair_text,can_mod_post,score,approved_by,is_created_from_ads_ui,author_premium,thumbnail,edited,author_flair_css_class,author_flair_richtext,gildings,post_hint,content_categories,is_self,mod_note,created,link_flair_type,wls,removed_by_category,banned_by,author_flair_type,domain,allow_live_comments,selftext_html,likes,suggested_sort,banned_at_utc,view_count,archived,no_follow,is_crosspostable,pinned,over_18,preview,all_awardings,awarders,media_only,link_flair_template_id,can_gild,spoiler,locked,author_flair_text,treatment_tags,visited,removed_by,num_reports,distinguished,subreddit_id,author_is_blocked,mod_reason_by,removal_reason,link_flair_background_color,id,is_robot_indexable,report_reasons,author,discussion_type,num_comments,send_replies,whitelist_status,contest_mode,mod_reports,author_patreon_flair,author_flair_text_color,permalink,parent_whitelist_status,stickied,url,subreddit_subscribers,created_utc,num_crossposts,media,is_video,author_cakeday,url_overridden_by_dest
,Python,"

""I didn't have time to write a short letter, so I wrote a long one instead.""

This is a long one, so I'm putting the TLDR up top:

# TLDR
A blackout has been proposed for June 12-14 to protest the API changes and extreme cost. 

The r/Python community seems very vocal about joining the blackout and I would like the r/Python community's input on this. Would you like to participate? How would you like to participate? 

If we do join the blackout, there are two different ways to participate which we need:
- Setting the subreddit to private (no engagement at all--including no ability to explain why our sub is private)
- Turning off submissions (the community and posts are still viewable, but no new comments or posts)

Please offer your feedback here, this isn't my decision alone to make.

# Background to the issue:
Reddit has been making changes. 

Ahead of their IPO, they're trying to get their ducks in a row, but in trying to maximize their value to potential shareholders, they're cutting off massive avenues of value to moderators and users. 
* Reddit, without warning, cut off [Pushshift's API access](https://www.reddit.com/r/modnews/comments/134tjpe/reddit_data_api_update_changes_to_pushshift_access/) (The stated reason is no response--but given their pricing structure for 3rd party mobile apps, and the time frame Reddit gave third party apps, any response by pushshift would have almost certainly resulted in this same action)
* Reddit is making a move to [remove API access to third party apps and developers](https://www.reddit.com/r/modnews/comments/13wshdp/api_update_continued_access_to_our_api_for/). It's no stretch that this move is motivated because after a number of years they're unable to compete in the mobile app space. So instead of 'git-ing gud' they're just shutting down competition. [Apollo App Response](https://www.reddit.com/r/apolloapp/comments/13ws4w3/had_a_call_with_reddit_to_discuss_pricing_bad/), [Rif Response](https://www.reddit.com/r/redditisfun/comments/13wxepd/rif_dev_here_reddits_api_changes_will_likely_kill/)
* They said RES will experience 'minimal' impact and old Reddit will be preserved. In the words of the Toolbox devs, ""[[they are not impacted.] Yet](https://www.reddit.com/r/toolbox/comments/141locs/announcement_reddits_upcoming_api_changes_and/jn0klpy/?context=10000) (Toolbox is a great tool for moderation because moderating with Reddit's site tools alone is a pain), and similarly [RES developers are not overly trusting](https://www.reddit.com/r/RESAnnouncements/comments/141hyv3/announcement_res_reddits_upcoming_api_changes/). Similarly, the [API once was safe](https://www.reddit.com/r/ModCoord/comments/142jwv3/oh_really_spez/jn5f0of/)
* [Reddit has laid off 5% of their staff](https://www.reuters.com/technology/reddit-lay-off-about-5-workforce-wsj-2023-06-06/)

The above actions are presented with bias--because frankly I am biased and Reddit is presenting their reasoning with bias so please take both sides' explanations with a grain of salt. Or Crait's worth of salt. But I feel they are presented accurately enough for this post's purpose. 

# Why we care about these changes:
## As a Moderator
There are a number of issues that a moderator has to deal with. 

First and foremost, I volunteer to do this. Moderation can be a drain on my energy, and is a time sink. Losing efficiencies reduce my ability to moderate, and Reddit Inc is laughably behind. 

* Reporting content as a moderator for admin review is an absolute pain, often a black box, there's at least three separate ways to report something instead of one consolidated form or three ways with parity across all three. The mechanisms have some overlap too. It's bad. 
* Often the admin response is subpar. As a mod I get that, my responses are subpar as well, and often times purposefully subpar because you need to make a decision on some content and there's just only so much to go off of. But it's for the extreme cases that the subpar response becomes a problem, like when there's a clear botnet falsifying engagement, and I've highlighted 10 accounts in it, and highlighted the way to flag them, and only two of those get tagged as ""actioned for ban evasion"" and the other 8 are free to keep on posting. Identifying a botnet should be easy on the Reddit side, it's exhausting on mine. One of the ways to help flag this is groups like Pushshift, and loosing that means I either knowingly allow manipulation or I give up more volunteer time hunting manipulation down. (By the way the specific one I am being vague about was brought to my attention thanks to a user's report. If they didn't flag it I probably would have missed that botnet, small though it was, so I really appreciate those comments and reports).
* I cannot trust the admins. This isn't combative in nature, but it's because we have different goals. Often times they align, but sometimes our goals are at odds of each other. My goal is to try to make sure the communities I moderate are best able to thrive, and Reddit Inc's goals are to drive engagement and ad revenue. Usually, like when we get to do something fun like a great AMA, we get great community events and Reddit gets engagement and clicks. But long term, Reddit will always follow profit. 

So these changes impact my workflow, and avenues to review and moderate content. And these are issues impacting our community. /r/Python is a great sub and great community. Compared to a lot of other subreddit we have relatively few issues. 

Communities which are identity, political, or news in nature have to deal with so much more. There's a ton to manage, there's a ton of filtering for mental health and safety that is needed too. Reddit is getting there when it comes to a lot of features, but their implementation is slow. It's getting measurably faster as they restructure, but they're still catching up to third party apps. 



## As a reddit user/Python developer
APIs are important. They're a wonderful gateway to programming, they help webpages serve information in a more lightweight fashion when webscraping would be costly (if you just need an upvote count, it's smarter to just make a call for than, then making a call for every asset a webpage renders. This gets a user what they need and isn't a burden on the site they're engaging with). APIs as a result both act as a great learning mechanism and as a way to keep from burdening the site as a whole.

No third party apps as alternatives makes it easier for Reddit to harvest data without pushback. And it makes it harder for users to customize their experience. This can be exceptionally important when it comes to communities which cater to important segments of the population, but segments which are so small that a profit focused organization would otherwise ignore. 

One of the more notable communities that these changes strongly impact is /r/blind, and there's an [explanation of these changes and their impact here](https://www.reddit.com/r/Blind/comments/13zr8h2/reddits_recently_announced_api_changes_and_the/). It's very probable that these issues will be quickly addressed now that they're in the public eye. But the underlying reality is that third party apps had been able to cater to users and communities and the Reddit app, with Reddit's stewardship, has failed to address accessibility at this level. 



# The Blackout
On June 12th a [blackout has been purposed](https://www.reddit.com/r/Save3rdPartyApps/comments/13yh0jf/dont_let_reddit_kill_3rd_party_apps/). 

[Many communities are praticipating](https://www.reddit.com/r/ModCoord/comments/1401qw5/incomplete_and_growing_list_of_participating/), and as this post points out we're curious if we should join. The blackout is either to cover a two day span, or last until demands are appropriately addressed. (this distinction is on a community basis, and will probably depend on how reddit responds)

There are different ways to perform it, either set the sub to private or lock the sub so no submissions can go through. Setting the sub to private prevents all engagement in the sub, but also means that presenting a message to users about what is going on isn't possible. 

I think it makes sense to keep the sub up and visible but to freeze it so no new posts or comments go through, but I'd like to hear your thoughts. 

# The Admins Response to the blackout
[Here is their reply](https://www.reddit.com/r/modnews/comments/141oqn8/api_updates_questions/)


A rough TLDR (I'm omitting the NSFW changes because... They're not clear to me. Maybe that's my shortfall but I think they're very vague about those)
1) Reddit isn't changing their position at all. They're digging in their heels and 'clarifying' what they're doing. No decision is reversed. 
2) bots using api for mod tools will be safe--if they break ""[Reddit] will work with you to fix them. "" 
3) launching at future dates: mod features 

___
On 2)--they basically told Apollo app to, ""Figure it out themselves""  https://www.reddit.com/r/redditdev/comments/13wsiks/api_update_enterprise_level_tier_for_large_scale/jmolrhn/?context=3
so forgive me if I don't find goodwill in that message. 

On 3) So many of those updates exist already in third party apps. So many of them are only getting attention this long into the Reddit app's lifespan because mods are making a stink about not moderating through the Reddit app. So especially for the rollout date of Sept. portions--I don't really believe it'll be executed well. And I don't want the mobile app on my phone. It's big, slow, and harvests a lot of data. 

And when that post went live Reddit was breaking again. 

https://www.redditstatus.com/

Not really something that exudes confidence in their ability to make good product decisions.

Now being fair here, there absolutely has been a [focus on improving modtools](https://www.reddit.com/r/reddit/comments/107orxe/ringing_in_2023_with_a_2022_reflection_on_mod/) over this past year, but they're still wildly behind. It's.. uncomfortable to trust a site when they cut off the alternatives for profit. Once there's no competition there's no longer a reason to loose revenue on further developing these resources. 

We were a part of the Reddit Talk platform development, and the admins we got to work with were lovely, and worked hard to greenlight the features moderators requested. A lot of those features were fleshing out the API so we could handle a Reddit Talk session in our workflows. 

But after a while [they shutdown Reddit Talk](https://www.reddit.com/r/RedditTalk/comments/11m4ijn/sunsetting_reddit_talk/) and that makes it difficult to trust long term product commitments from Reddit. Even if we get great admins who listen to feedback rolling out a product--they're not ultimately the ones who make the calls for the future. 

The admin response to the threat of a blackout reaffirms their changes and makes a lot of future promises for moderation tools. They sound good but at best those features should have been here ages ago, and their presentation betrays a lack of focus or care for moderation tools until recently. That recent change is affirming to see, but looking at Reddit's track record it might just be a passing phase until the public eye is off of the company. 


# What does this mean to /r/Python
That is mostly my question to you.

There are some defined things:

- If we blackout, the sub turns off. No one can post or comment for a while, and we hope our added voice helps encourage Reddit to continue to allow third party apps.
- If we don't join the blackout, we can still hope but there's less weight behind it. 

We don't normally join in on Reddit's protests. So this would be a new thing for our community--is this cause worth the loss in a few days of posts?

There is a [post by another user asking this question](https://old.reddit.com/r/Python/comments/1424s7m/going_dark_on_12th_june/) and at present it is the second most upvoted submission in the past year. So there has been a lot of great talk already, but I need to ask this question here as well to be sure I'm listening to the community as a whole. 

**Should /r/Python join the June 12th Blackout?** 

If we do, should we completely go private, or should we prevent the commenting or posting in our community during that period so an explanation of what is going on is viewable?

Please give your feedback, I'm reading through both this and the original submission to keep an eye on things. Remember though, be respectful. We're a Python focused community, so in addition to the rules here in the sub, I hope you'll adhere to the [PSF Code of Conduct](https://www.python.org/psf/conduct/). Be respectful to one another. Disagree with opinions, but be respectful of people. 

And now for [something completely different](https://www.reddit.com/user/iamkindofcreative/m/a_green_space/)",t2_9iikd,False,,0,False,Should r/Python participate in the June 12th Blackout protesting the API changes,"[{'e': 'text', 't': 'Meta'}]",r/Python,False,6,meta,0,,,False,t3_1434dxo,False,dark,0.96,transparent,public,3612,0,{},,4cc838b8-3159-11e1-83e4-12313d18ad57,False,[],,False,False,,{},Meta,False,3612,,False,False,self,False,,"[{'e': 'text', 't': 'bot_builder: deprecated'}]",{},self,,True,,1686115761.0,richtext,6,,,richtext,self.Python,True,"&lt;!-- SC_OFF --&gt;&lt;div class=""md""&gt;&lt;p&gt;&amp;quot;I didn&amp;#39;t have time to write a short letter, so I wrote a long one instead.&amp;quot;&lt;/p&gt;

&lt;p&gt;This is a long one, so I&amp;#39;m putting the TLDR up top:&lt;/p&gt;

&lt;h1&gt;TLDR&lt;/h1&gt;

&lt;p&gt;A blackout has been proposed for June 12-14 to protest the API changes and extreme cost. &lt;/p&gt;

&lt;p&gt;The &lt;a href=""/r/Python""&gt;r/Python&lt;/a&gt; community seems very vocal about joining the blackout and I would like the &lt;a href=""/r/Python""&gt;r/Python&lt;/a&gt; community&amp;#39;s input on this. Would you like to participate? How would you like to participate? &lt;/p&gt;

&lt;p&gt;If we do join the blackout, there are two different ways to participate which we need:
- Setting the subreddit to private (no engagement at all--including no ability to explain why our sub is private)
- Turning off submissions (the community and posts are still viewable, but no new comments or posts)&lt;/p&gt;

&lt;p&gt;Please offer your feedback here, this isn&amp;#39;t my decision alone to make.&lt;/p&gt;

&lt;h1&gt;Background to the issue:&lt;/h1&gt;

&lt;p&gt;Reddit has been making changes. &lt;/p&gt;

&lt;p&gt;Ahead of their IPO, they&amp;#39;re trying to get their ducks in a row, but in trying to maximize their value to potential shareholders, they&amp;#39;re cutting off massive avenues of value to moderators and users. 
* Reddit, without warning, cut off &lt;a href=""https://www.reddit.com/r/modnews/comments/134tjpe/reddit_data_api_update_changes_to_pushshift_access/""&gt;Pushshift&amp;#39;s API access&lt;/a&gt; (The stated reason is no response--but given their pricing structure for 3rd party mobile apps, and the time frame Reddit gave third party apps, any response by pushshift would have almost certainly resulted in this same action)
* Reddit is making a move to &lt;a href=""https://www.reddit.com/r/modnews/comments/13wshdp/api_update_continued_access_to_our_api_for/""&gt;remove API access to third party apps and developers&lt;/a&gt;. It&amp;#39;s no stretch that this move is motivated because after a number of years they&amp;#39;re unable to compete in the mobile app space. So instead of &amp;#39;git-ing gud&amp;#39; they&amp;#39;re just shutting down competition. &lt;a href=""https://www.reddit.com/r/apolloapp/comments/13ws4w3/had_a_call_with_reddit_to_discuss_pricing_bad/""&gt;Apollo App Response&lt;/a&gt;, &lt;a href=""https://www.reddit.com/r/redditisfun/comments/13wxepd/rif_dev_here_reddits_api_changes_will_likely_kill/""&gt;Rif Response&lt;/a&gt;
* They said RES will experience &amp;#39;minimal&amp;#39; impact and old Reddit will be preserved. In the words of the Toolbox devs, &amp;quot;&lt;a href=""https://www.reddit.com/r/toolbox/comments/141locs/announcement_reddits_upcoming_api_changes_and/jn0klpy/?context=10000""&gt;[they are not impacted.] Yet&lt;/a&gt; (Toolbox is a great tool for moderation because moderating with Reddit&amp;#39;s site tools alone is a pain), and similarly &lt;a href=""https://www.reddit.com/r/RESAnnouncements/comments/141hyv3/announcement_res_reddits_upcoming_api_changes/""&gt;RES developers are not overly trusting&lt;/a&gt;. Similarly, the &lt;a href=""https://www.reddit.com/r/ModCoord/comments/142jwv3/oh_really_spez/jn5f0of/""&gt;API once was safe&lt;/a&gt;
* &lt;a href=""https://www.reuters.com/technology/reddit-lay-off-about-5-workforce-wsj-2023-06-06/""&gt;Reddit has laid off 5% of their staff&lt;/a&gt;&lt;/p&gt;

&lt;p&gt;The above actions are presented with bias--because frankly I am biased and Reddit is presenting their reasoning with bias so please take both sides&amp;#39; explanations with a grain of salt. Or Crait&amp;#39;s worth of salt. But I feel they are presented accurately enough for this post&amp;#39;s purpose. &lt;/p&gt;

&lt;h1&gt;Why we care about these changes:&lt;/h1&gt;

&lt;h2&gt;As a Moderator&lt;/h2&gt;

&lt;p&gt;There are a number of issues that a moderator has to deal with. &lt;/p&gt;

&lt;p&gt;First and foremost, I volunteer to do this. Moderation can be a drain on my energy, and is a time sink. Losing efficiencies reduce my ability to moderate, and Reddit Inc is laughably behind. &lt;/p&gt;

&lt;ul&gt;
&lt;li&gt;Reporting content as a moderator for admin review is an absolute pain, often a black box, there&amp;#39;s at least three separate ways to report something instead of one consolidated form or three ways with parity across all three. The mechanisms have some overlap too. It&amp;#39;s bad. &lt;/li&gt;
&lt;li&gt;Often the admin response is subpar. As a mod I get that, my responses are subpar as well, and often times purposefully subpar because you need to make a decision on some content and there&amp;#39;s just only so much to go off of. But it&amp;#39;s for the extreme cases that the subpar response becomes a problem, like when there&amp;#39;s a clear botnet falsifying engagement, and I&amp;#39;ve highlighted 10 accounts in it, and highlighted the way to flag them, and only two of those get tagged as &amp;quot;actioned for ban evasion&amp;quot; and the other 8 are free to keep on posting. Identifying a botnet should be easy on the Reddit side, it&amp;#39;s exhausting on mine. One of the ways to help flag this is groups like Pushshift, and loosing that means I either knowingly allow manipulation or I give up more volunteer time hunting manipulation down. (By the way the specific one I am being vague about was brought to my attention thanks to a user&amp;#39;s report. If they didn&amp;#39;t flag it I probably would have missed that botnet, small though it was, so I really appreciate those comments and reports).&lt;/li&gt;
&lt;li&gt;I cannot trust the admins. This isn&amp;#39;t combative in nature, but it&amp;#39;s because we have different goals. Often times they align, but sometimes our goals are at odds of each other. My goal is to try to make sure the communities I moderate are best able to thrive, and Reddit Inc&amp;#39;s goals are to drive engagement and ad revenue. Usually, like when we get to do something fun like a great AMA, we get great community events and Reddit gets engagement and clicks. But long term, Reddit will always follow profit. &lt;/li&gt;
&lt;/ul&gt;

&lt;p&gt;So these changes impact my workflow, and avenues to review and moderate content. And these are issues impacting our community. &lt;a href=""/r/Python""&gt;/r/Python&lt;/a&gt; is a great sub and great community. Compared to a lot of other subreddit we have relatively few issues. &lt;/p&gt;

&lt;p&gt;Communities which are identity, political, or news in nature have to deal with so much more. There&amp;#39;s a ton to manage, there&amp;#39;s a ton of filtering for mental health and safety that is needed too. Reddit is getting there when it comes to a lot of features, but their implementation is slow. It&amp;#39;s getting measurably faster as they restructure, but they&amp;#39;re still catching up to third party apps. &lt;/p&gt;

&lt;h2&gt;As a reddit user/Python developer&lt;/h2&gt;

&lt;p&gt;APIs are important. They&amp;#39;re a wonderful gateway to programming, they help webpages serve information in a more lightweight fashion when webscraping would be costly (if you just need an upvote count, it&amp;#39;s smarter to just make a call for than, then making a call for every asset a webpage renders. This gets a user what they need and isn&amp;#39;t a burden on the site they&amp;#39;re engaging with). APIs as a result both act as a great learning mechanism and as a way to keep from burdening the site as a whole.&lt;/p&gt;

&lt;p&gt;No third party apps as alternatives makes it easier for Reddit to harvest data without pushback. And it makes it harder for users to customize their experience. This can be exceptionally important when it comes to communities which cater to important segments of the population, but segments which are so small that a profit focused organization would otherwise ignore. &lt;/p&gt;

&lt;p&gt;One of the more notable communities that these changes strongly impact is &lt;a href=""/r/blind""&gt;/r/blind&lt;/a&gt;, and there&amp;#39;s an &lt;a href=""https://www.reddit.com/r/Blind/comments/13zr8h2/reddits_recently_announced_api_changes_and_the/""&gt;explanation of these changes and their impact here&lt;/a&gt;. It&amp;#39;s very probable that these issues will be quickly addressed now that they&amp;#39;re in the public eye. But the underlying reality is that third party apps had been able to cater to users and communities and the Reddit app, with Reddit&amp;#39;s stewardship, has failed to address accessibility at this level. &lt;/p&gt;

&lt;h1&gt;The Blackout&lt;/h1&gt;

&lt;p&gt;On June 12th a &lt;a href=""https://www.reddit.com/r/Save3rdPartyApps/comments/13yh0jf/dont_let_reddit_kill_3rd_party_apps/""&gt;blackout has been purposed&lt;/a&gt;. &lt;/p&gt;

&lt;p&gt;&lt;a href=""https://www.reddit.com/r/ModCoord/comments/1401qw5/incomplete_and_growing_list_of_participating/""&gt;Many communities are praticipating&lt;/a&gt;, and as this post points out we&amp;#39;re curious if we should join. The blackout is either to cover a two day span, or last until demands are appropriately addressed. (this distinction is on a community basis, and will probably depend on how reddit responds)&lt;/p&gt;

&lt;p&gt;There are different ways to perform it, either set the sub to private or lock the sub so no submissions can go through. Setting the sub to private prevents all engagement in the sub, but also means that presenting a message to users about what is going on isn&amp;#39;t possible. &lt;/p&gt;

&lt;p&gt;I think it makes sense to keep the sub up and visible but to freeze it so no new posts or comments go through, but I&amp;#39;d like to hear your thoughts. &lt;/p&gt;

&lt;h1&gt;The Admins Response to the blackout&lt;/h1&gt;

&lt;p&gt;&lt;a href=""https://www.reddit.com/r/modnews/comments/141oqn8/api_updates_questions/""&gt;Here is their reply&lt;/a&gt;&lt;/p&gt;

&lt;p&gt;A rough TLDR (I&amp;#39;m omitting the NSFW changes because... They&amp;#39;re not clear to me. Maybe that&amp;#39;s my shortfall but I think they&amp;#39;re very vague about those)
1) Reddit isn&amp;#39;t changing their position at all. They&amp;#39;re digging in their heels and &amp;#39;clarifying&amp;#39; what they&amp;#39;re doing. No decision is reversed. 
2) bots using api for mod tools will be safe--if they break &amp;quot;[Reddit] will work with you to fix them. &amp;quot; 
3) launching at future dates: mod features &lt;/p&gt;

&lt;hr/&gt;

&lt;p&gt;On 2)--they basically told Apollo app to, &amp;quot;Figure it out themselves&amp;quot;  &lt;a href=""https://www.reddit.com/r/redditdev/comments/13wsiks/api_update_enterprise_level_tier_for_large_scale/jmolrhn/?context=3""&gt;https://www.reddit.com/r/redditdev/comments/13wsiks/api_update_enterprise_level_tier_for_large_scale/jmolrhn/?context=3&lt;/a&gt;
so forgive me if I don&amp;#39;t find goodwill in that message. &lt;/p&gt;

&lt;p&gt;On 3) So many of those updates exist already in third party apps. So many of them are only getting attention this long into the Reddit app&amp;#39;s lifespan because mods are making a stink about not moderating through the Reddit app. So especially for the rollout date of Sept. portions--I don&amp;#39;t really believe it&amp;#39;ll be executed well. And I don&amp;#39;t want the mobile app on my phone. It&amp;#39;s big, slow, and harvests a lot of data. &lt;/p&gt;

&lt;p&gt;And when that post went live Reddit was breaking again. &lt;/p&gt;

&lt;p&gt;&lt;a href=""https://www.redditstatus.com/""&gt;https://www.redditstatus.com/&lt;/a&gt;&lt;/p&gt;

&lt;p&gt;Not really something that exudes confidence in their ability to make good product decisions.&lt;/p&gt;

&lt;p&gt;Now being fair here, there absolutely has been a &lt;a href=""https://www.reddit.com/r/reddit/comments/107orxe/ringing_in_2023_with_a_2022_reflection_on_mod/""&gt;focus on improving modtools&lt;/a&gt; over this past year, but they&amp;#39;re still wildly behind. It&amp;#39;s.. uncomfortable to trust a site when they cut off the alternatives for profit. Once there&amp;#39;s no competition there&amp;#39;s no longer a reason to loose revenue on further developing these resources. &lt;/p&gt;

&lt;p&gt;We were a part of the Reddit Talk platform development, and the admins we got to work with were lovely, and worked hard to greenlight the features moderators requested. A lot of those features were fleshing out the API so we could handle a Reddit Talk session in our workflows. &lt;/p&gt;

&lt;p&gt;But after a while &lt;a href=""https://www.reddit.com/r/RedditTalk/comments/11m4ijn/sunsetting_reddit_talk/""&gt;they shutdown Reddit Talk&lt;/a&gt; and that makes it difficult to trust long term product commitments from Reddit. Even if we get great admins who listen to feedback rolling out a product--they&amp;#39;re not ultimately the ones who make the calls for the future. &lt;/p&gt;

&lt;p&gt;The admin response to the threat of a blackout reaffirms their changes and makes a lot of future promises for moderation tools. They sound good but at best those features should have been here ages ago, and their presentation betrays a lack of focus or care for moderation tools until recently. That recent change is affirming to see, but looking at Reddit&amp;#39;s track record it might just be a passing phase until the public eye is off of the company. &lt;/p&gt;

&lt;h1&gt;What does this mean to &lt;a href=""/r/Python""&gt;/r/Python&lt;/a&gt;&lt;/h1&gt;

&lt;p&gt;That is mostly my question to you.&lt;/p&gt;

&lt;p&gt;There are some defined things:&lt;/p&gt;

&lt;ul&gt;
&lt;li&gt;If we blackout, the sub turns off. No one can post or comment for a while, and we hope our added voice helps encourage Reddit to continue to allow third party apps.&lt;/li&gt;
&lt;li&gt;If we don&amp;#39;t join the blackout, we can still hope but there&amp;#39;s less weight behind it. &lt;/li&gt;
&lt;/ul&gt;

&lt;p&gt;We don&amp;#39;t normally join in on Reddit&amp;#39;s protests. So this would be a new thing for our community--is this cause worth the loss in a few days of posts?&lt;/p&gt;

&lt;p&gt;There is a &lt;a href=""https://old.reddit.com/r/Python/comments/1424s7m/going_dark_on_12th_june/""&gt;post by another user asking this question&lt;/a&gt; and at present it is the second most upvoted submission in the past year. So there has been a lot of great talk already, but I need to ask this question here as well to be sure I&amp;#39;m listening to the community as a whole. &lt;/p&gt;

&lt;p&gt;&lt;strong&gt;Should &lt;a href=""/r/Python""&gt;/r/Python&lt;/a&gt; join the June 12th Blackout?&lt;/strong&gt; &lt;/p&gt;

&lt;p&gt;If we do, should we completely go private, or should we prevent the commenting or posting in our community during that period so an explanation of what is going on is viewable?&lt;/p&gt;

&lt;p&gt;Please give your feedback, I&amp;#39;m reading through both this and the original submission to keep an eye on things. Remember though, be respectful. We&amp;#39;re a Python focused community, so in addition to the rules here in the sub, I hope you&amp;#39;ll adhere to the &lt;a href=""https://www.python.org/psf/conduct/""&gt;PSF Code of Conduct&lt;/a&gt;. Be respectful to one another. Disagree with opinions, but be respectful of people. &lt;/p&gt;

&lt;p&gt;And now for &lt;a href=""https://www.reddit.com/user/iamkindofcreative/m/a_green_space/""&gt;something completely different&lt;/a&gt;&lt;/p&gt;
&lt;/div&gt;&lt;!-- SC_ON --&gt;",,,,,True,False,False,False,False,"{'images': [{'source': {'url': 'https://external-preview.redd.it/mEX7l-UXo9ca9K0LZiWBBhGWUWFDnaT5hgUUFxv_UFg.jpg?auto=webp&amp;s=296445061e7d975e771fece4630133da15ed3731', 'width': 1200, 'height': 628}, 'resolutions': [{'url': 'https://external-preview.redd.it/mEX7l-UXo9ca9K0LZiWBBhGWUWFDnaT5hgUUFxv_UFg.jpg?width=108&amp;crop=smart&amp;auto=webp&amp;s=f94c6ddb82a74e72ce23f3d605c1f57e7c619ca4', 'width': 108, 'height': 56}, {'url': 'https://external-preview.redd.it/mEX7l-UXo9ca9K0LZiWBBhGWUWFDnaT5hgUUFxv_UFg.jpg?width=216&amp;crop=smart&amp;auto=webp&amp;s=9949989e32497cb74487d52f0158772b317ec20a', 'width': 216, 'height': 113}, {'url': 'https://external-preview.redd.it/mEX7l-UXo9ca9K0LZiWBBhGWUWFDnaT5hgUUFxv_UFg.jpg?width=320&amp;crop=smart&amp;auto=webp&amp;s=eee57ecee969c5b7b2ca6c61068a5d026e2b53c4', 'width': 320, 'height': 167}, {'url': 'https://external-preview.redd.it/mEX7l-UXo9ca9K0LZiWBBhGWUWFDnaT5hgUUFxv_UFg.jpg?width=640&amp;crop=smart&amp;auto=webp&amp;s=fbcd73ef0ae0a848a358fc9632d8598f62f4dd74', 'width': 640, 'height': 334}, {'url': 'https://external-preview.redd.it/mEX7l-UXo9ca9K0LZiWBBhGWUWFDnaT5hgUUFxv_UFg.jpg?width=960&amp;crop=smart&amp;auto=webp&amp;s=74085e2b3181d2574f90179b7ed0b1abfd3a9525', 'width': 960, 'height': 502}, {'url': 'https://external-preview.redd.it/mEX7l-UXo9ca9K0LZiWBBhGWUWFDnaT5hgUUFxv_UFg.jpg?width=1080&amp;crop=smart&amp;auto=webp&amp;s=8f4ec7c8a17b6f349701acbb53c8d579a0a6b0e2', 'width': 1080, 'height': 565}], 'variants': {}, 'id': '4RnkIkdDfvpzu8yHWwx-zBEf_op-qTDCXA6OvvSI8Zg'}], 'enabled': False}",[],[],False,1a0ad668-4115-11ea-b5c6-0ee3885b83fb,False,False,False,bot_builder: deprecated,[],False,,,moderator,t5_2qh0y,False,,,,1434dxo,True,,IAmKindOfCreative,,337,True,all_ads,False,[],False,dark,/r/Python/comments/1434dxo/should_rpython_participate_in_the_june_12th/,all_ads,False,https://www.reddit.com/r/Python/comments/1434dxo/should_rpython_participate_in_the_june_12th/,1219908,1686115761.0,0,,False,,
